Company_name,Rating,Location,Job_title,Description,Job_age,Easy_apply,Salary,Employees,Type_of_ownership,Sector,Founded,Industry,Revenue_USD,Friend_recommend,CEO_approval,Career_opportunities,Comp_&_benefits,Culture_&_values,Senior_management,Work/Life_balance,Pros,Cons,Benefits_rating,Benefits_reviews
Apple,4.2,Helsinki,Diffractive Optics Designer,"Summary
Posted: Dec 16, 2022
Role Number:200450019
Do something different! Apple is looking for a world class engineer that can help identify and incubate new display technologies. You will work with both suppliers and internal teams at Apple to shape the display related technologies that go into Apple products. A successful candidate will not only need to identify new tech, but also educate a broad audience of people at Apple about their benefits and tradeoffs. This position is focusing on the identification, prototyping, and communication of display technologies for future Apple products. The team features a diverse engineering roster including optical engineers, human perception experts, product design engineers, and experimental physicists. We work at a fast pace and require everyone to be highly self- motivated. A successful candidate needs to be a flexible thinker and be able to problem solve outside of their respective technical area.",23d,False,,10000+,Company - Public,Information Technology,1976,Computer Hardware Development,$10+ billion,0.83,0.9,3.8,4.3,4.2,3.7,3.7,"['""Great benefits like full health insurance and discounts on products and bet of all share purchases with big discount."" (in 3962 reviews)', '""work was ok and pay was good"" (in 3368 reviews)', '""You get to meet some really great people with strong passions and can make lifelong friendships"" (in 3350 reviews)', '""Good work life balance Interesting work Very stable"" (in 2799 reviews)', '""Most of management is great and very technical."" (in 1883 reviews)']","['""Not much responsibility and no benefit"" (in 3962 reviews)', '""The pay is low especially when living in San Diego where rent and housing cost is super inflated."" (in 3368 reviews)', '""People are rude and you work in a mall"" (in 3350 reviews)', '""No work life balance (made you feel bad about taking time off for mental health reasons)"" (in 2799 reviews)', '""Poor management and tolls"" (in 1883 reviews)']",4.5,"['Employee Discount (1098 comments)\n""The best thing is that you\'re able to get products for a cheaper price, but the discounts definitely could have been higher""', 'Health Insurance (883 comments)\n""UHW deductible is low with HSA""', '401K Plan (481 comments)\n""No 401K plan is offered just RRSP""']"
Mps Finland Consulting,,Helsinki,Senior Data Engineer,"Kiinnostaako sinua työskentely Suomen kolmanneksi suurimmassa rahoituslaitoksessa? Haluatko olla vaikuttamassa suomalaista yhteiskuntaa vastuullisesti rakentavan luottolaitoksen kehitykseen, keskeisessä roolissa laadukkaan ja tavoitteellisen tietovarastoinnin kehittäjänä?
Haemme asiakkaallemme Kuntarahoitukselle Yrityssuunnittelu ja Tiedonhallinta -yksikköön kokenutta Senior Data Engineeriä.
Tehtävässä vastaat tietoalustaamme ja keskitettyyn tietovarastoomme liittyvien ratkaisujen suunnittelusta, toteutuksesta ja ylläpidosta, aina lähdejärjestelmistä tietovaraston hyödyntämisrajapintoihin asti. Tietoalustalla ja tietovarastollamme on keskeinen rooli kokonaisarkkitehtuurissamme, tukien tehokasta liiketoimintaa ja luoden perustan laadukkaalle ja pitkälle automatisoidulle raportoinnille. Tulevina vuosina tulemme laajentamaan tietovarastoa ja sen käyttöä erityisesti taloudellisen tiedon ja raportoinnin alueella.",8d,False,,,Company - Public,,,,,,,,,,,,,,,
Nigel Frank International Limited,3.0,Helsinki,Senior Azure Data Engineer / Architect,"Senior Azure Data Engineer / Architect
SRDTENGC1_1675749604
I am working with a fast growing company currently around 60 big but looking to expand by 90 in the next 5 years based in the heart of Helsinki! The Company focuses solely on Azure Data warehousing / Analytics as well as Azure integrations.

They are looking for senior Azure data engineers / Architects to join their excellent and quality senior team, who are working on large exciting projects in the private sector.

No boring maintenance work, all outsourced so their team can focus solely on the important work to be done. This company works with Microsoft from time to time who come to them for help as a trusted partner.

Responsibilities:


What they are looking for:


What they offer:


If you'd like more information please send your CV and contact me at:

Max William Bright

m.bright@nigelfrank.com

+358942452104

https://www.linkedin.com/in/max-bright-646457186/

Whilst this position offers remote working all candidates must be located inside Finland with a valid work Visa.

All interviews will be carried out remotely.",30d+,False,,1001 to 5000,,,,,,0.44,,3.1,2.5,2.7,2.6,2.5,"['""Good Training and support system"" (in 23 reviews)', '""Awesome management"" (in 23 reviews)', '""Big plus was they matched the salary I asked for but as I worked I found out others made significantly less."" (in 28 reviews)', '""Amazing culture"" (in 22 reviews)']","['""No training!"" (in 23 reviews)', '""Bad management, bad hours and wacky expectations"" (in 23 reviews)', '""Long hours if you want to make real money"" (in 24 reviews)', '""Base salary"" (in 28 reviews)', '""Homophobic and misogynistic culture."" (in 22 reviews)']",5.0,
Aiven,3.9,Helsinki,Senior Backend Engineer - Python,"Aiven aims to be the world's leading cloud data platform - simply by making developer's lives better. We are a cast of over 500 'Crabs' with a passion for open-source and a cutting edge tech stack. We take ownership of the problems we solve and act with courage. Openness is our beating heart.
It takes an uncommon person to contribute to the common good. Would you like to join our Cast where everyone at every level works side-by-side on making developers' lives better, and letting them build what matters most?
Aiven in a crabshell:
Our platform delivers reliable and secure data ops
Global service footprint & support organization",30d+,True,,201 to 500,Company - Private,Information Technology,2016,Computer Hardware Development,,0.74,0.87,4.1,4.3,3.9,3.4,3.8,"['""high willingness to impart knowledge | no micromanagement of tasks and responsibilities | excellent provision of work equipment | awesome work culuture and best colleagues I\'ve worked with"" (in 23 reviews)', '""Good work life balance."" (in 9 reviews)', '""Trust based culture"" (in 18 reviews)', '""+ Good salary + 100% remote work possibility + Lovely people with great expertise + A lot of work for culture"" (in 13 reviews)', '""Very supportive colleagues and management"" (in 11 reviews)']","['""No work/life balance, they intentionally organize calls and meetings outside employees working hours."" (in 9 reviews)', '""19 has not made growth and keeping up the culture any easier."" (in 18 reviews)', '""Company is growing fast, management seems to be in constant changing."" (in 11 reviews)']",,
Nigel Frank International Limited,3.0,Helsinki,Azure Data Engineer,"Azure Data Engineer
DA-01-AZ_1678442084
This client is looking to bring on-board hungry mid-level Azure Data Engineers, that want to grow into senior roles.

This is a great time to join a smaller consultancy, that are growing rapidly!

Roles and Responsibilities:

In this role you will be working with to 500 revenue clients


Skills & Qualifications:




Benefits:",30d+,False,,1001 to 5000,,,,,,0.44,,3.1,2.5,2.7,2.6,2.5,"['""Good Training and support system"" (in 23 reviews)', '""Awesome management"" (in 23 reviews)', '""Big plus was they matched the salary I asked for but as I worked I found out others made significantly less."" (in 28 reviews)', '""Amazing culture"" (in 22 reviews)']","['""No training!"" (in 23 reviews)', '""Bad management, bad hours and wacky expectations"" (in 23 reviews)', '""Long hours if you want to make real money"" (in 24 reviews)', '""Base salary"" (in 28 reviews)', '""Homophobic and misogynistic culture."" (in 22 reviews)']",5.0,
Apple,4.2,Helsinki,Diffractive Optics Designer,"Summary
Posted: Dec 16, 2022
Role Number:200450019
Do something different! Apple is looking for a world class engineer that can help identify and incubate new display technologies. You will work with both suppliers and internal teams at Apple to shape the display related technologies that go into Apple products. A successful candidate will not only need to identify new tech, but also educate a broad audience of people at Apple about their benefits and tradeoffs. This position is focusing on the identification, prototyping, and communication of display technologies for future Apple products. The team features a diverse engineering roster including optical engineers, human perception experts, product design engineers, and experimental physicists. We work at a fast pace and require everyone to be highly self- motivated. A successful candidate needs to be a flexible thinker and be able to problem solve outside of their respective technical area.",23d,False,,10000+,Company - Public,Information Technology,1976,Computer Hardware Development,$10+ billion,0.83,0.9,3.8,4.3,4.2,3.7,3.7,"['""Great benefits like full health insurance and discounts on products and bet of all share purchases with big discount."" (in 3962 reviews)', '""work was ok and pay was good"" (in 3368 reviews)', '""You get to meet some really great people with strong passions and can make lifelong friendships"" (in 3350 reviews)', '""Good work life balance Interesting work Very stable"" (in 2799 reviews)', '""Most of management is great and very technical."" (in 1883 reviews)']","['""Not much responsibility and no benefit"" (in 3962 reviews)', '""The pay is low especially when living in San Diego where rent and housing cost is super inflated."" (in 3368 reviews)', '""People are rude and you work in a mall"" (in 3350 reviews)', '""No work life balance (made you feel bad about taking time off for mental health reasons)"" (in 2799 reviews)', '""Poor management and tolls"" (in 1883 reviews)']",4.5,"['Employee Discount (1098 comments)\n""The best thing is that you\'re able to get products for a cheaper price, but the discounts definitely could have been higher""', 'Health Insurance (883 comments)\n""UHW deductible is low with HSA""', '401K Plan (481 comments)\n""No 401K plan is offered just RRSP""']"
Nigel Frank International Limited,3.0,Helsinki,Azure Data Engineer's & Azure Data Architect's,"Azure Data Engineer's & Azure Data Architect's
21STRHLN_1674532807
Azure Data Engineer's & Azure Data Architect's - Helsinki region - Permanent job

I am working with a fast growing company currently around 60 big but looking to expand by 90 in the next 5 years based in the heart of Helsinki! The company focuses solely on Azure Data warehousing / Analytics as well as Azure integrations.

They are looking for senior Azure data engineers / Architects to join their excellent and quality senior team, who are working on large exciting projects in the private sector.

No boring maintenance work, all outsourced so their team can focus solely on the important work to be done. This company works with Microsoft from time to time who come to them for help as a trusted partner.

Responsibilities


What they are looking for


What they offer




If you'd like more information please send your CV and contact me at:

d.field@nigelfrank.com

+358 75 3266 582

If this is not the exact role you were looking for, get in touch anyway! Just send me an email anyway and highlight what interests you, we can have a look for other options.",30d+,False,,1001 to 5000,,,,,,0.44,,3.1,2.5,2.7,2.6,2.5,"['""Good Training and support system"" (in 23 reviews)', '""Awesome management"" (in 23 reviews)', '""Big plus was they matched the salary I asked for but as I worked I found out others made significantly less."" (in 28 reviews)', '""Amazing culture"" (in 22 reviews)']","['""No training!"" (in 23 reviews)', '""Bad management, bad hours and wacky expectations"" (in 23 reviews)', '""Long hours if you want to make real money"" (in 24 reviews)', '""Base salary"" (in 28 reviews)', '""Homophobic and misogynistic culture."" (in 22 reviews)']",5.0,
ABB Oy,4.0,Helsinki,Senior MES Engineer - Quality Data Management,"Take your next career step at ABB with a global team that is energizing the transformation of society and industry to achieve a more productive, sustainable future.
At ABB, we have the clear goal of driving diversity and inclusion across all dimensions: gender, LGBTQ+, abilities, ethnicity and generations. Together, we are embarking on a journey where each and every one of us, individually and collectively, welcomes and celebrates individual differences.
Would you like to be at the front of delivering pulp and paper Manufacturing Execution System (MES) Solutions to our Global Customers? MES is a key cornerstone of industrial digitalization and our business and investments are rapidly growing in this area. Therefore we are looking for a Senior MES Engineer at ABB Oy, Process Industries Division in Helsinki, Varkaus, Oulu or Tampere to strengthen our team. In this role you will be a keyperson in our pulp and paper MES delivery projects.",27d,False,,10000+,Company - Public,Manufacturing,1883,Electronics Manufacturing,$10+ billion,0.82,0.89,3.7,3.6,4.0,3.5,3.8,"['""processes are well defined and work life balance good"" (in 619 reviews)', '""Good Salary and project exposure"" (in 821 reviews)', '""Good benefit and remuneration package"" (in 347 reviews)', '""Good management and get to work remotely"" (in 406 reviews)', '""Good culture and athmosphere in general"" (in 604 reviews)']","['""No work life balance and no decent hike"" (in 619 reviews)', '""Low salaries and less organized and no defined responsibilities"" (in 821 reviews)', '""No benefits...compare to other MNCs..in respect to increments..."" (in 347 reviews)', '""poor management and review system"" (in 406 reviews)', '""Bad culture and i didn\'t like the food"" (in 604 reviews)']",3.7,"['Health Insurance (87 comments)\n""Lack of coverage for common transgender care compared to other large companies.""', 'Vacation & Paid Time Off (71 comments)\n""Unlimited time off. Good if you have a good manager and you stay on top of claiming it.""', '401K Plan (46 comments)\n""3% plus 75% match up to 6% employee contribution.""']"
GE Healthcare,4.3,Helsinki,Software Engineer,"Job Description Summary
Healthcare is developing fast in the fields of bedside monitoring, wireless, and mobile technologies. If you want to be part of the most exciting technology development today, then GE offers you that and more. Our work is solving technical challenges for an important purpose. We develop technologies to make healthcare affordable and accessible all over the world.

We are looking for developers to work on the design, implementation, and testing of a medical application. We have two open positions for clinical application & UI and middleware development.

GE Healthcare is a leading global medical technology and digital solutions innovator. Our mission is to improve lives in the moments that matter. Unlock your ambition, turn ideas into world-changing realities, and join an organization where every voice makes a difference, and every difference builds a healthier world.",30d+,False,,10000+,Company - Public,Healthcare,1892,Health Care Services & Hospitals,$10+ billion,0.88,0.93,4.1,4.0,4.2,3.9,4.0,"['""Good work life balance and work too"" (in 500 reviews)', '""Good benefits and pension scheme"" (in 341 reviews)', '""good salary paid on time"" (in 486 reviews)', '""Good team and culture"" (in 511 reviews)', '""Great products and people."" (in 549 reviews)']","['""There is No Work life balance"" (in 500 reviews)', '""No benefits or whatsoever."" (in 341 reviews)', '""low salary compared to other companies and dynamically changes its stance on business objectives especially in india."" (in 486 reviews)', '""The culture is toxic."" (in 511 reviews)', '""15 people who will try to behave like your boss."" (in 549 reviews)']",3.8,"['Health Insurance (111 comments)\n""The company provides private healthcare.""', '401K Plan (90 comments)\n""401k plan at GE is good""', 'Vacation & Paid Time Off (51 comments)\n""Vacation and paid time off available""']"
GE Healthcare,4.3,Helsinki,(Senior) Mechanical Design Engineer,"Job Description Summary
GE HealthCare, a leading global health technology provider, has strong presence in Helsinki. In the Vallila district, we are 700+ people from over 25 countries, helping healthcare providers improve patient care.
Job Description
Our engineering teams need help to develop our new product family (https://www.gehealthcare.co.uk/products/patient-monitoring/portrait-mobile). If you have experience in mechanical design in portable devices and you like creating new and innovative solutions and solving customer problems, then GE offers you that and much more. We develop technologies that improve patient care all over the world.",13d,False,,10000+,Company - Public,Healthcare,1892,Health Care Services & Hospitals,$10+ billion,0.88,0.93,4.1,4.0,4.2,3.9,4.0,"['""Good work life balance and work too"" (in 500 reviews)', '""Good benefits and pension scheme"" (in 341 reviews)', '""good salary paid on time"" (in 486 reviews)', '""Good team and culture"" (in 511 reviews)', '""Great products and people."" (in 549 reviews)']","['""There is No Work life balance"" (in 500 reviews)', '""No benefits or whatsoever."" (in 341 reviews)', '""low salary compared to other companies and dynamically changes its stance on business objectives especially in india."" (in 486 reviews)', '""The culture is toxic."" (in 511 reviews)', '""15 people who will try to behave like your boss."" (in 549 reviews)']",3.8,"['Health Insurance (111 comments)\n""The company provides private healthcare.""', '401K Plan (90 comments)\n""401k plan at GE is good""', 'Vacation & Paid Time Off (51 comments)\n""Vacation and paid time off available""']"
ABB,4.0,Helsinki,R&D Engineer,"R&D Engineer
Take your next career step at ABB with a global team that is energizing the transformation of society and industry to achieve a more productive, sustainable future. At ABB, we have the clear goal of driving diversity and inclusion across all dimensions: gender, LGBTQ+, abilities, ethnicity and generations. Together, we are embarking on a journey where each and every one of us, individually and collectively, welcomes and celebrates individual differences.

We are looking for a R&D Engineer at ABB Oy, Large Motors and Generators division in Helsinki. You will be member of our mechanical performance team in Research and Development. In this role, you will contribute to product development projects, maintenance tasks, resolution of technical support cases by conducting simulations and measurements. You will have an opportunity to learn from experienced colleagues, grow your engineering skills in the field of mechanical simulation and measurement and take next steps in your career. You will work in an international organization in co-operation with sales, design, local and global manufacturing, and other ABB business lines. This position is located in Large Motors & Generators premises in Helsinki, Finland. Our R&D Engineers and scientists develop breakthrough technologies that change the way the world works, and industries do business. We constantly push the limits of convention, while retaining our focus on delivering solid returns for our customers and shareholders. Benefits we offer at the moment include e.g. an annual performance bonus, a flexible working model, subsidized lunch, development & training, employee share ownership program, benefits for families with children, sports, massage and cultural benefits and many hobby clubs.",15d,False,,10000+,Company - Public,Manufacturing,1883,Electronics Manufacturing,$10+ billion,0.82,0.89,3.7,3.6,4.0,3.5,3.8,"['""processes are well defined and work life balance good"" (in 619 reviews)', '""Good Salary and project exposure"" (in 821 reviews)', '""Good benefit and remuneration package"" (in 347 reviews)', '""Good management and get to work remotely"" (in 406 reviews)', '""Good culture and athmosphere in general"" (in 604 reviews)']","['""No work life balance and no decent hike"" (in 619 reviews)', '""Low salaries and less organized and no defined responsibilities"" (in 821 reviews)', '""No benefits...compare to other MNCs..in respect to increments..."" (in 347 reviews)', '""poor management and review system"" (in 406 reviews)', '""Bad culture and i didn\'t like the food"" (in 604 reviews)']",3.7,"['Health Insurance (87 comments)\n""Lack of coverage for common transgender care compared to other large companies.""', 'Vacation & Paid Time Off (71 comments)\n""Unlimited time off. Good if you have a good manager and you stay on top of claiming it.""', '401K Plan (46 comments)\n""3% plus 75% match up to 6% employee contribution.""']"
DoubleVerify,4.3,Helsinki,Senior ML Engineer,"Who we are
DoubleVerify is the leading independent provider of marketing measurement software, data and analytics that authenticates the quality and effectiveness of digital media for the world's largest brands and media platforms. DV provides media transparency and accountability to deliver the highest level of impression quality for maximum advertising performance. Since 2008, DV has helped hundreds of Fortune 500 companies gain the most from their media spend by delivering best in class solutions across the digital ecosystem, helping to build a better industry. Learn more at www.doubleverify.com.

What will you do",9d,True,,201 to 500,Company - Public,Information Technology,2008,Internet & Web Services,,0.86,0.93,4.1,4.3,4.3,4.1,4.4,"['""Great people to learn from."" (in 45 reviews)', '""I have a good work life balance and my ideas are valued."" (in 30 reviews)', '""Management is always very supportive; doesn’t feel toxic or hostile like majority of other workplaces."" (in 18 reviews)', '""If you\'re into the American "" awesome"" culture, you\'ll be in good hands here."" (in 31 reviews)', '""Excellent benefits Excellent inter"" (in 21 reviews)']","['""worst people I ever met in life"" (in 45 reviews)', '""There is no work/life balance and management will text you at all times at home on your personal cell to demand work get done."" (in 30 reviews)', '""Not so technological, bad management, a graveyard for engineers."" (in 18 reviews)', '""Stock compensation does not keep up with peers Engineering culture is a little weak on some teams"" (in 31 reviews)']",4.4,"['Maternity & Paternity Leave (5 comments)\n""stock package Annual bonus 8 additional days off at the expense of the company apart from the days given to each employee. An addition of 4 additional months of maternity leave for both women and men. Gym""', '401K Plan (4 comments)\n""Matching is the best. no down side""', 'Health Insurance (3 comments)\n""Wonderful plans, with potential dependent coverage.""']"
Unikie,4.3,Helsinki,Machine Learning Engineer,"At the moment we are looking for Machine Learning Engineer to join our team in Helsinki to work on developing next-generation computer vision (CV) and natural language processing (NLP) technologies. The responsibility involves working with various problems related to CV and NLP but is not limited to object recognition, video understanding, OCR, natural language analysis, and visual-language multimodal. You will join a close-knit team of highly accomplished researchers and research engineers to deliver cutting-edge technologies that impact millions of users.
As a member of this team, you will use your deep understanding of your engineering skills to tackle meaningful technical problems and collaborate with the world’s most innovative product development teams. Together with other researchers, you will perform designing, implementing, and optimizing CV/NLP/ML algorithms to tackle new challenges and hardware capabilities in large model training. You will have the opportunity to transfer your knowledge into solutions for some of the most challenging technical problems in the next generation products.",15d,False,,51 to 200,Company - Public,,,,,0.89,,4.2,3.7,3.9,4.1,4.2,"['""Good salary and exciting projects"" (in 4 reviews)', '""Good atmosphere"" (in 2 reviews)', '""Talented people, versatile environment, growth opportunity"" (in 1 reviews)']","['""Sometimes colleagues could be a little more senior in their competences."" (in 3 reviews)', '""No good benefits, lunch benefits are a joke"" (in 1 reviews)']",,
