Company_name,Rating,Location,Job_title,Description,Job_age,Easy_apply,Salary,Employees,Type_of_ownership,Sector,Founded,Industry,Revenue_USD,Friend_recommend,CEO_approval,Career_opportunities,Comp_&_benefits,Culture_&_values,Senior_management,Work/Life_balance,Pros,Cons,Benefits_rating,Benefits_reviews
Canonical - Jobs,3.1,Helsinki,Software Engineer - Launchpad,"Drive the future of collaborative open source development tooling as part of the Launchpad team. This is an opportunity for a motivated engineer with a passion for open source software, Linux, and web services to join our distributed team.
Launchpad is a platform for managing open source development projects. It includes code hosting and review, bug tracking, package building, translations, and other facilities used by free and open source software developers. It provides essential development and collaboration infrastructure for major projects such as Ubuntu.
Launchpad is a mature project, mainly written in Python (primarily Zope, with some Flask). You'll be striking a balance between keeping our business-critical services running and expanding our feature set: among other things, we are currently working on expanding our package building capabilities, improving the development flows provided to our users, and modernising our web UI. If you love keeping large projects well-organised and well-maintained, care about supporting developers, and believe that continuous improvement is the key to innovation, higher velocity, and reliability, you'll fit right in.",9d,False,,501 to 1000,Company - Private,Information Technology,2004,Computer Hardware Development,$25 to $100 million,0.55,0.53,3.3,3.4,3.1,2.7,3.5,"['""Remote work Open source work Great people"" (in 48 reviews)', '""Good management"" (in 33 reviews)', '""A good salary is not a substitute for a miserable life."" (in 27 reviews)', '""Work from home, in your timezone, no extra hours (unless very rare situations)"" (in 20 reviews)']","['""men surrounding CEO and CTO"" (in 41 reviews)', '""having to learn about everything means very few people are truly specialized at what they do"" (in 48 reviews)', '""Management is not consistent, path to promotion is foggy"" (in 33 reviews)', '""If you do get hired, base salary is average at best, and extended benefits such as matching 401(k) are nonexistent."" (in 27 reviews)']",3.3,"['Work From Home (10 comments)\n""Fully remote working environment for most employees""', 'Health Insurance (8 comments)\n""No cost as individual employee""', 'Vacation & Paid Time Off (5 comments)\n""Must use personal days for end of year break""']"
Accenture,4.1,Tampere,Cloud Data Platform Engineer,"Haemme Data Platform Engineer -osaajia Accenture Data & AI -yksikköön, jossa sinulla on mahdollisuus työskennellä samanhenkisten ja inspiroivien kollegoiden kanssa käyttäen uusimpia teknologioita.
Meille Data Platform Engineer tarkoittaa devops-kehittäjän ja sovelluskehittäjän yhdistelmää, jolla on vahva datapainotus. Tehtävänäsi on auttaa asiakkaitamme kehittämään korkealaatuisia pilvipohjaisia data-alustoja ja niihin liittyviä DevOps ja IaC -kyvykkyyksiä.
Data Platform Engineer roolissa osana tiimiä suunnittelet, toteutat/konfiguroit, testaat ja ylläpidät data-alustojen teknologiapinoa, kehitys- ja tuotantoympäristöjä sekä CI/CD ja IaC -automaatioita. Lisäsi tuet muuta tiimiä DevOps-ratkaisuiden käyttämisessä. Työnäsi on mahdollistaa ja nopeuttaa dataintensiivisten sovellusten kehittämistä. Tarvittaessa sinulla on myös itselläsi kyky toteuttaa dataintensiivisiä sovelluksia data-alustaan hyödyntäen. Työssäsi hyödynnät tarjolla olevia pilvipalveluita (Azure, AWS, GCP).",30d+,False,,10000+,Company - Public,Management & Consulting,1989,Business Consulting,$10+ billion,0.8,0.88,4.0,3.9,4.0,3.7,3.8,"['""It has been 7 months working in Accenture.....never felt work tirelessly.....trainings are good and good work life balance"" (in 14817 reviews)', '""Good salary hikes and accenture showed why it is people’s company with its covid related policies."" (in 15613 reviews)', '""Working here is good because the work culture is good and we get to reskill and upskill ourselves."" (in 10897 reviews)', '""encourage employees to upskilling themself and gain some certifications Many events in the premises always Benefits are good"" (in 5997 reviews)', '""Good Management and Woman friendly"" (in 6872 reviews)']","['""For few proj work is to much where we need to extend and no work life balance for women employees"" (in 14817 reviews)', '""Low salary for resources who are loyal and staying with the company for long years."" (in 15613 reviews)', '""Unprofessional and bad work culture"" (in 10897 reviews)', '""no benefits and just a contractor"" (in 5997 reviews)', '""I was in Accenture Kolkata and here management are very very poor like political leader (leader with zero knowledge)."" (in 6872 reviews)']",4.2,"['401K Plan (573 comments)\n""6% Match best in industry""', 'Health Insurance (488 comments)\n""Multiple options are provided for Health insurance""', 'Vacation & Paid Time Off (457 comments)\n""Smooth overall. It depends on team""']"
ICEYE,3.9,Espoo,Senior Machine Learning Engineer,"Position: Machine Learning Engineer, Senior
Location: Finland
Hiring Model: WAH/ Hybrid/ On-site
Who are we?
We are a Finnish-based international New Space company with employees from more than 57 countries in Finland, the US, the UK, Spain, Luxembourg, and Poland. Our team is a tight-knit group of experts from areas including engineering, software development, and radar technology. We’re innovative, driven people who strive for excellence in everything we do. Being advocates of our corporate culture, we value teamwork and curiosity, and we know how to have fun!
What do we do?
ICEYE is building and operating its commercial constellation of small Synthetic Aperture Radar (SAR) satellites with SAR data available to customers. Our satellites acquire images of Earth at any time – even when it’s cloudy or dark – providing commercial and government partners with unmatched persistent monitoring capabilities. Information derived from our SAR images helps customers make data-driven decisions to address time-critical challenges in various sectors, such as maritime, disaster management, insurance, and finance.
What are we looking for?
We are looking for a Senior Machine Learning Engineer to help explore novel deep learning capabilities that can be applied to remote sensing imagery. You will report to the Machine Learning Team Lead in the Analytics team.



:


Diversity& inclusion are core values at ICEYE. We are passionate about building and sustaining inclusive and equitable working and learning environments for all staff. We believe every member on our team enriches our diversity by exposing us to a broad range of ways to understand and engage with the world, identify challenges, and discover, design, and deliver solutions.
Could this be the role for you? Apply now to start your journey with ICEYE.
We are making the impossible possible together.
Contact
Olha Pryshlyak
Recruiting@iceye.fi",30d+,True,,201 to 500,Company - Public,Aerospace & Defense,2015,Aerospace & Defense,,0.79,0.86,3.7,3.6,3.9,3.3,3.3,"['""Good benefits overall"" (in 7 reviews)', '""Salary is competitive and includes a variety of great employee benefits."" (in 10 reviews)', '""great friendly culture"" (in 18 reviews)', '""Exciting company to work for Doing some amazing things with New Space technology Amazing group of staff"" (in 14 reviews)', '""Very diverse, awesome team, love the office spaces and the company culture"" (in 12 reviews)']","['""Pay and benefits are average for the industry."" (in 7 reviews)', '""Salary is not the best, the company manufactures satellites, which isn\'t a cheap thing to do, there are fees for ground stations, for the company which is sending the satellite out to space, etc, which are all reasons for why the company isn\'t swimming in cash."" (in 10 reviews)', '""Culture, no visibility in company’s long term goals"" (in 18 reviews)']",,
Tuxera,4.8,Helsinki,DevOps Engineer,"Tuxera's Global Engineering Infrastructure (GEI) is hiring talented, knowledgeable, energetic persons to join the DevOps team to support our software developers and testers.
You are a hands-on person who will bring experience, best practices, and a collaborative ethic to help drive our DevOps initiatives.
The position is located in Helsinki (Espoo), Finland.

Tasks and responsibilities:
You will build awesome automation and streamline R&D operations to the delight of our customers and engineers. Your guiding principle is to enable the entire team to effortlessly build, test and deploy their magic. In doing so, you will nurture a product development effort that powers the world-leading customers around the world.",30d+,True,,51 to 200,Company - Private,Information Technology,2008,Enterprise Software & Network Solutions,$5 to $25 million,1.0,1.0,4.4,4.8,5.0,4.7,4.8,"['""Great team, great management, excellent work"" (in 3 reviews)', '""Low hierarchy and lots of freedom to start projects and develop yourself."" (in 1 reviews)', '""Everybody is very friendly and the overall atmosphere is fun and relaxed."" (in 1 reviews)']","['""Some processes are missing in multiple teams"" (in 3 reviews)']",,
Skylo Technologies,3.7,Espoo,Radio Access Network Engineer,"Skylo Technologies is hiring a Radio Access Network (RAN) Engineer to join our Network Planning and Engineering team to implement Skylo's vision of building out a carrier-grade Satellite IOT network. This role will be highly cross-functional, working across the network operations, wireless systems, and development teams. This is a terrific opportunity for someone who is interested to stretch themselves in their network domain, and see their work have immediate global impact in the wireless industry.
Responsibilities:
Support the planning, design and integration of Skylo's 3GPP satellite radio access network and its associated interfaces
Lead projects in planning and design of each RAN site with full network diagram, cabling and BoM",30d+,False,,51 to 200,Company - Private,,,,,0.73,0.78,3.4,3.6,3.5,3.5,3.6,"['""Open culture and friendly team"" (in 12 reviews)', '""The best company to do work with, nice people, nice atmosphere, Weekend bash"" (in 9 reviews)', '""Good learning opportunity"" (in 4 reviews)', '""Good salary and good enviornment to work"" (in 3 reviews)', '""Great Environment to work with.....many things to learn"" (in 8 reviews)']","['""Shockingly toxic culture and extremely disappointing leadership"" (in 12 reviews)']",5.0,
Skylo Technologies,3.7,Espoo,Sr. System Test Engineer,"Skylo Technologies is hiring a Senior System Test Engineer onsite, in Espoo, Finland to implement a carrier-grade Satellite IoT network. This role will be highly cross-functional, working across the network engineering, wireless systems, and network operations teams. This is a terrific opportunity for someone who is interested to stretch themselves in their network domain, and see their work have immediate global impact in the wireless industry.
Responsibilities:
Plan, execute, and document tests to verify and validate Skylo NTN system behavior and performance, expose issues, and identify root causes
Work closely with the device, wireless systems, RAN, core and data mobility platform engineering teams and to execute system acceptance testing that will verify end-to-end functionality of the Skylo Non-terrestrial Networking (NTN) system",30d+,False,,51 to 200,Company - Private,,,,,0.73,0.78,3.4,3.6,3.5,3.5,3.6,"['""Open culture and friendly team"" (in 12 reviews)', '""The best company to do work with, nice people, nice atmosphere, Weekend bash"" (in 9 reviews)', '""Good learning opportunity"" (in 4 reviews)', '""Good salary and good enviornment to work"" (in 3 reviews)', '""Great Environment to work with.....many things to learn"" (in 8 reviews)']","['""Shockingly toxic culture and extremely disappointing leadership"" (in 12 reviews)']",5.0,
Analog Devices,4.1,Vantaa,RF Field Applications Engineer - Finland,"Analog Devices (NASDAQ: ADI) designs and manufactures semiconductor products and solutions. We enable our customers to interpret the world around us by intelligently bridging the physical and digital worlds with unmatched technologies that sense, measure and connect.
Field Applications Engineer: RF & Comm´s Market
Location: Finland
Description:
Candidate will provide field applications support to Strategic and Key customers utilizing Analog Devices broad product portfolio predominantly focused on “Antenna to Bits” solutions for RF and microwave signal processing applications. This involves working with customers, sales teams, and product development teams to identify key opportunities, and position the best solutions tailored to customer needs and grow Analog Devices market share. Primary focus will be on RF & Communications markets. This position will be based in the Finland with some travel to Customer sites in the region and globally.


Job Req Type: Experienced
Required Travel: Yes, 25% of the time
Shift Type: 1st Shift/Days",30d+,False,,10000+,Company - Public,Manufacturing,1965,Electronics Manufacturing,$10+ billion,0.86,0.92,3.9,3.7,4.0,3.6,3.9,"['""Work life balance is good"" (in 239 reviews)', '""Good benefits and learning ground"" (in 154 reviews)', '""People are great and friendly"" (in 221 reviews)', '""Salary is good"" (in 309 reviews)', '""Good enviroment and culture."" (in 213 reviews)']","['""No Work life balance on some focus group"" (in 239 reviews)', '""Other benefits could be better"" (in 154 reviews)', '""Some people are great and get back to you so you can support the customers."" (in 221 reviews)', '""low salary and nothing to say"" (in 309 reviews)', '""better culture"" (in 213 reviews)']",4.1,"['Health Insurance (39 comments)\n""Fantastic health insurance is provided.""', 'Vacation & Paid Time Off (39 comments)\n""Average vacation time is provided.""', '401K Plan (27 comments)\n""Fantastic 401k plan is offered.""']"
Tuxera,4.8,Espoo,Field Applications Engineer,"Tuxera is looking for an experienced Field Applications Engineer.

You will work as a crucial liaison between our customers and the R&D team. You support business development and customer accounts by working on technical support projects, with strong support from the team. In the projects, you also ensure the schedules and deliveries are aligned with the project plans.
Your daily work includes the following:
Support customers through the integration phase of Tuxera products by offering integration advise
Support product evaluation testing by bridging customers and Tuxera R&D for possible questions in the process",30d+,True,,51 to 200,Company - Private,Information Technology,2008,Enterprise Software & Network Solutions,$5 to $25 million,1.0,1.0,4.4,4.8,5.0,4.7,4.8,"['""Great team, great management, excellent work"" (in 3 reviews)', '""Low hierarchy and lots of freedom to start projects and develop yourself."" (in 1 reviews)', '""Everybody is very friendly and the overall atmosphere is fun and relaxed."" (in 1 reviews)']","['""Some processes are missing in multiple teams"" (in 3 reviews)']",,
Texas Instruments,4.2,Oulu,Applications Engineering Intern,"Why TI?
Engineer your future. We empower our employees to truly own their career and development. Come collaborate with some of the smartest people in the world to shape the future of electronics.
We're different by design. Diverse backgrounds and perspectives are what push innovation forward and what make TI stronger. We value each and every voice, and look forward to hearing yours. Meet the people of TI
Benefits that benefit you. We offer competitive pay and benefits designed to help you and your family live your best life. Your well-being is important to us.
About Texas Instruments
As a global semiconductor company, we design, manufacture, test and sell analog and embedded processing chips to nearly 100,000 customers. Our products enable electronics everywhere and in things you experience every day - from health care, smart homes and connected cars to drones, smart phones and more. Our passion to create a better and more sustainable world by making electronics more affordable through semiconductors drives us to make our technology smaller, more efficient, more reliable and more affordable.",30d+,False,,10000+,Company - Public,Manufacturing,1930,Electronics Manufacturing,$10+ billion,0.83,0.93,4.0,3.9,4.1,3.7,3.6,"['""It is good and good work life balance"" (in 341 reviews)', '""Good pay and even better bonuses"" (in 446 reviews)', '""Great people to work with"" (in 345 reviews)', '""Good benefit and well established company"" (in 225 reviews)', '""Great culture and very diverse"" (in 361 reviews)']","['""No work life balance eventhough the working hours is flexible"" (in 341 reviews)', '""Pay is low compared to the US."" (in 446 reviews)', '""People are facing burn out."" (in 345 reviews)', '""Benefits are not great."" (in 225 reviews)', '""Bad culture, all are rushed."" (in 361 reviews)']",4.2,"['Health Insurance (122 comments)\n""Good offer for all employees""', '401K Plan (88 comments)\n""4% matching to 401k plan is pretty standard.""', 'Vacation & Paid Time Off (70 comments)\n""Hard to get time off when short staffed""']"
ICEYE,3.9,Espoo,Machine Learning Engineer,"Position: Machine Learning Engineer
Location: Luxembourg, Finland
Hiring Model: Hybrid/ On-site
Who are we?
We are a Finnish-based international New Space company with employees from more than 57 countries in Finland, the US, the UK, Spain, Luxembourg, and Poland. Our team is a tight-knit group of experts from areas including engineering, software development, and radar technology. We’re innovative, driven people who strive for excellence in everything we do. Being advocates of our corporate culture, we value teamwork and curiosity, and we know how to have fun!
What do we do?
ICEYE is building and operating its commercial constellation of small Synthetic Aperture Radar (SAR) satellites with SAR data available to customers. Our satellites acquire images of Earth at any time – even when it’s cloudy or dark – providing commercial and government partners with unmatched persistent monitoring capabilities. Information derived from our SAR images helps customers make data-driven decisions to address time-critical challenges in various sectors, such as maritime, disaster management, insurance, and finance.
What are we looking for?
We are looking for a Machine Learning Engineer to help explore novel deep learning capabilities that can be applied to remote sensing imagery. You will report to the Machine Learning Team Lead in the Analytics Department. We are looking for candidates in Finland or those who want to relocate to Finland.



:


Diversity& inclusion are core values at ICEYE. We are passionate about building and sustaining inclusive and equitable working and learning environments for all staff. We believe every member on our team enriches our diversity by exposing us to a broad range of ways to understand and engage with the world, identify challenges, and discover, design, and deliver solutions.
Could this be the role for you? Apply now to start your journey with ICEYE
We are making the impossible possible together.
Contact
Olha Pryshlyak
Recruiting@iceye.fi",30d+,True,,201 to 500,Company - Public,Aerospace & Defense,2015,Aerospace & Defense,,0.79,0.86,3.7,3.6,3.9,3.3,3.3,"['""Good benefits overall"" (in 7 reviews)', '""Salary is competitive and includes a variety of great employee benefits."" (in 10 reviews)', '""great friendly culture"" (in 18 reviews)', '""Exciting company to work for Doing some amazing things with New Space technology Amazing group of staff"" (in 14 reviews)', '""Very diverse, awesome team, love the office spaces and the company culture"" (in 12 reviews)']","['""Pay and benefits are average for the industry."" (in 7 reviews)', '""Salary is not the best, the company manufactures satellites, which isn\'t a cheap thing to do, there are fees for ground stations, for the company which is sending the satellite out to space, etc, which are all reasons for why the company isn\'t swimming in cash."" (in 10 reviews)', '""Culture, no visibility in company’s long term goals"" (in 18 reviews)']",,
Texas Instruments,4.2,Helsinki,FAST Rotation Program-Field Applications Engineer Track - FInland,"We can't predict what the future holds, but we know Texas Instruments will have a part in shaping it. TI’s FAST (Field Applications & Sales Training) Rotation Program is designed to prepare Sales & Applications team members for customer-oriented careers that pair technical skills with business perspectives. The program provides experiences that help rising TIers understand how to successfully grow TI’s business and to thrive throughout their entire TI career. There are two available FAST program tracks: (1) Field Applications and (2) Technical Sales.
This 11-month experience aims to establish rising Field Applications Engineers (FAEs) as technical TI experts with customer engineers and internal teams.
Rotation 1 (6 month), Field Sales Office (FSO): The FSO rotation is centered on learning how to work directly with customers to solve technical challenges, and to ultimately maximize TI’s revenue by providing customers with the systems-level solutions that best address their design needs. Among other aspects, the FSO rotation focuses on analyzing technical trade-offs, understanding component selection, and solving design and cost challenges.",30d+,False,,10000+,Company - Public,Manufacturing,1930,Electronics Manufacturing,$10+ billion,0.83,0.93,4.0,3.9,4.1,3.7,3.6,"['""It is good and good work life balance"" (in 341 reviews)', '""Good pay and even better bonuses"" (in 446 reviews)', '""Great people to work with"" (in 345 reviews)', '""Good benefit and well established company"" (in 225 reviews)', '""Great culture and very diverse"" (in 361 reviews)']","['""No work life balance eventhough the working hours is flexible"" (in 341 reviews)', '""Pay is low compared to the US."" (in 446 reviews)', '""People are facing burn out."" (in 345 reviews)', '""Benefits are not great."" (in 225 reviews)', '""Bad culture, all are rushed."" (in 361 reviews)']",4.2,"['Health Insurance (122 comments)\n""Good offer for all employees""', '401K Plan (88 comments)\n""4% matching to 401k plan is pretty standard.""', 'Vacation & Paid Time Off (70 comments)\n""Hard to get time off when short staffed""']"
Accenture,4.1,Helsinki,Cloud Data Platform Engineer,"Haemme Data Platform Engineer -osaajia Accenture Data & AI -yksikköön, jossa sinulla on mahdollisuus työskennellä samanhenkisten ja inspiroivien kollegoiden kanssa käyttäen uusimpia teknologioita.
Meille Data Platform Engineer tarkoittaa devops-kehittäjän ja sovelluskehittäjän yhdistelmää, jolla on vahva datapainotus. Tehtävänäsi on auttaa asiakkaitamme kehittämään korkealaatuisia pilvipohjaisia data-alustoja ja niihin liittyviä DevOps ja IaC -kyvykkyyksiä.
Data Platform Engineer roolissa osana tiimiä suunnittelet, toteutat/konfiguroit, testaat ja ylläpidät data-alustojen teknologiapinoa, kehitys- ja tuotantoympäristöjä sekä CI/CD ja IaC -automaatioita. Lisäsi tuet muuta tiimiä DevOps-ratkaisuiden käyttämisessä. Työnäsi on mahdollistaa ja nopeuttaa dataintensiivisten sovellusten kehittämistä. Tarvittaessa sinulla on myös itselläsi kyky toteuttaa dataintensiivisiä sovelluksia data-alustaan hyödyntäen. Työssäsi hyödynnät tarjolla olevia pilvipalveluita (Azure, AWS, GCP).",30d+,False,,10000+,Company - Public,Management & Consulting,1989,Business Consulting,$10+ billion,0.8,0.88,4.0,3.9,4.0,3.7,3.8,"['""It has been 7 months working in Accenture.....never felt work tirelessly.....trainings are good and good work life balance"" (in 14817 reviews)', '""Good salary hikes and accenture showed why it is people’s company with its covid related policies."" (in 15613 reviews)', '""Working here is good because the work culture is good and we get to reskill and upskill ourselves."" (in 10897 reviews)', '""encourage employees to upskilling themself and gain some certifications Many events in the premises always Benefits are good"" (in 5997 reviews)', '""Good Management and Woman friendly"" (in 6872 reviews)']","['""For few proj work is to much where we need to extend and no work life balance for women employees"" (in 14817 reviews)', '""Low salary for resources who are loyal and staying with the company for long years."" (in 15613 reviews)', '""Unprofessional and bad work culture"" (in 10897 reviews)', '""no benefits and just a contractor"" (in 5997 reviews)', '""I was in Accenture Kolkata and here management are very very poor like political leader (leader with zero knowledge)."" (in 6872 reviews)']",4.2,"['401K Plan (573 comments)\n""6% Match best in industry""', 'Health Insurance (488 comments)\n""Multiple options are provided for Health insurance""', 'Vacation & Paid Time Off (457 comments)\n""Smooth overall. It depends on team""']"
