Company_name,Rating,Location,Job_title,Description,Job_age,Easy_apply,Salary,Employees,Type_of_ownership,Sector,Founded,Industry,Revenue_USD,Friend_recommend,CEO_approval,Career_opportunities,Comp_&_benefits,Culture_&_values,Senior_management,Work/Life_balance,Pros,Cons,Benefits_rating,Benefits_reviews
ICEYE,3.9,Helsinki,Lead Quality Software Engineer - Finland,"Position: Lead Quality Software Engineer
Location: Espoo, Finland
Hiring Model: Hybrid

Who are we:
We are a Finnish-based international New Space company with employees from more than 57 countries in Finland, the US, the UK, Spain, Luxembourg, and Poland. Our team is a tight-knit group of experts from areas including engineering, software development, and radar technology. We’re innovative, driven people who strive for excellence in everything we do. Being advocates of our corporate culture, we value teamwork and curiosity, and we know how to have fun!

What do we do:
ICEYE is building and operating its commercial constellation of small Synthetic Aperture Radar (SAR) satellites with SAR data available to customers. Our satellites acquire images of Earth at any time – even when it’s cloudy or dark – providing commercial and government partners with unmatched persistent monitoring capabilities. Information derived from our SAR images helps customers make data-driven decisions to address time-critical challenges in various sectors, such as maritime, disaster management, insurance, and finance.


To support the company's growth, we are now looking for an experienced Lead Quality Engineer to join our Flight Software team. The position location is in our headquarters in Espoo, Finland.


ICEYE is committed to delivering high-quality data on time to its customers. You will help to ensure it will keep happening working in the Flight Software team.
Our team is responsible for the software that runs in the embedded systems of ICEYE’s spacecraft. This software manages onboard activities, data processing, power management, communication with the ground, propulsion system, and spacecraft health and safety. You will work with technologies such as Embedded Linux, ARM-based microcontrollers, SoCs, and RTOS.
The Flight Software team is a critical group in the company, continuously implementing new features and developing new subsystems for the new satellites and the ones in our fleet. You will build and lead the process and strategy for a good quality approach. We would appreciate it if you could help us with the full view of the test pyramid.






Could this be the role for you? Apply now to start your journey with ICEYE. We are making the impossible possible together.

Contact

Riya Vidhani (Talent Acquisition Partner)

riya.vidhani@iceye.fi",27d,True,,201 to 500,Company - Public,Aerospace & Defense,2015,Aerospace & Defense,,0.79,0.86,3.7,3.6,3.9,3.3,3.3,"['""Good benefits overall"" (in 7 reviews)', '""Salary is competitive and includes a variety of great employee benefits."" (in 10 reviews)', '""great friendly culture"" (in 18 reviews)', '""Exciting company to work for Doing some amazing things with New Space technology Amazing group of staff"" (in 14 reviews)', '""Very diverse, awesome team, love the office spaces and the company culture"" (in 12 reviews)']","['""Pay and benefits are average for the industry."" (in 7 reviews)', '""Salary is not the best, the company manufactures satellites, which isn\'t a cheap thing to do, there are fees for ground stations, for the company which is sending the satellite out to space, etc, which are all reasons for why the company isn\'t swimming in cash."" (in 10 reviews)', '""Culture, no visibility in company’s long term goals"" (in 18 reviews)']",,
ABB Oy,4.0,Helsinki,Senior Software Service Engineers,"Take your next career step at ABB with a global team that is energizing the transformation of society and industry to achieve a more productive, sustainable future.
At ABB, we have the clear goal of driving diversity and inclusion across all dimensions: gender, LGBTQ+, abilities, ethnicity and generations. Together, we are embarking on a journey where each and every one of us, individually and collectively, welcomes and celebrates individual differences.
Would you like to be at the front of supporting and servicing Operational Excellence software like the pulp and paper Manufacturing Execution System (MES) Solutions to our Global Customers? Operation excellence softwares, like different MES and MOM, are a key cornerstone of industrial digitalization and our business and investments are rapidly growing in this area.",25d,False,,10000+,Company - Public,Manufacturing,1883,Electronics Manufacturing,$10+ billion,0.82,0.89,3.7,3.6,4.0,3.5,3.8,"['""processes are well defined and work life balance good"" (in 619 reviews)', '""Good Salary and project exposure"" (in 821 reviews)', '""Good benefit and remuneration package"" (in 347 reviews)', '""Good management and get to work remotely"" (in 406 reviews)', '""Good culture and athmosphere in general"" (in 604 reviews)']","['""No work life balance and no decent hike"" (in 619 reviews)', '""Low salaries and less organized and no defined responsibilities"" (in 821 reviews)', '""No benefits...compare to other MNCs..in respect to increments..."" (in 347 reviews)', '""poor management and review system"" (in 406 reviews)', '""Bad culture and i didn\'t like the food"" (in 604 reviews)']",3.7,"['Health Insurance (87 comments)\n""Lack of coverage for common transgender care compared to other large companies.""', 'Vacation & Paid Time Off (71 comments)\n""Unlimited time off. Good if you have a good manager and you stay on top of claiming it.""', '401K Plan (46 comments)\n""3% plus 75% match up to 6% employee contribution.""']"
Scandit,4.5,Tampere,Senior C++ Mobile Software Engineer,"*Please note as much as this is a remote position, we are only able to consider candidates based in (or willing to relocate to) Switzerland, Finland, Poland, France, Italy, Spain, Germany, and the UK.*
At Scandit, we develop real-time computer vision solutions for smartphones, wearables and robots that combine modern machine learning approaches with computer vision. To expand our engineering team, we are looking for a C++ Mobile Software Engineer.
About the role
You'll help guide the implementation of our cross-platform API's to ensure consistency, as well as write multithreaded code on a modern cross platform C++ code base, that makes use of the full range of today's hardware capabilities. You'll be the connection between our Computer Vision/ML Engineers and the Android/iOS experts on our market-leading software.",30d+,True,,501 to 1000,Company - Private,Information Technology,2009,Enterprise Software & Network Solutions,,0.95,0.98,3.9,4.1,4.5,4.2,4.4,"['""Great people and amazing team spirit"" (in 32 reviews)', '""Great Culture, Feel like you make an impact to company success"" (in 31 reviews)', '""Lots of support from management in both day"" (in 14 reviews)', '""flexibility to work from home and in the office is tremendous and allows for a solid work life balance."" (in 5 reviews)', '""Great leadership, and support from everyone in the company, to all others."" (in 9 reviews)']","['""People are constantly trying to get better though."" (in 32 reviews)', '""Management often takes very long to make certain decisions that could be made faster"" (in 14 reviews)']",3.7,
MBR Partners,5.0,Helsinki,GSI Partner Sales Director,"The Company
Our client is one of the fastest growing Software companies that own the number one operating system in the cloud sold across the globe as one of the most popular development platforms. Our client`s renown Product is the fastest growing enterprise platform, the leading platform for public cloud compute, and the engineer's favorite path to dive into the future. Their aim is to help the enterprise welcome open source from end to end, across every category of compute and application, starting with infrastructure solutions such as Kubernetes and OpenStack, to data, analytics, security and serverless capabilities. Their clients range from Global 500 enterprises and telcos, and managed service providers at big scale, to fast-moving startups.
Our client provides managed services, commercial support, training and consulting services to their clients who are deploying their Product. They also support technical staff and partners to provide best guidance and practices across their projects.",30d+,True,,1 to 50,Company - Private,,,,,1.0,1.0,4.6,4.6,5.0,5.0,4.3,"['""great team and management location and facilities"" (in 1 reviews)']",['No Cons have been reported by the Glassdoor community.'],,
Unikie,4.3,Tampere,Embedded Linux Software Engineer,"At the moment we are looking for experienced Embedded Linux Software Engineer to strengthen our Tampere team. You would start your journey in one of our most interesting and challenging projects.
As a software engineer you will be responsible for SW integration and configuration for the new hardware system in close collaboration with your colleague engineers. You will participate from higher level SW stack components integration down to lower layer SW components. You will also get in touch with the new RISC-V system-on-chip (SoC) SW as provided by SoC vendor. New customer requests may offer an opportunity to design and implement new software. This gives the chance to drive your SW pull request through the open sourcing process.
Your future colleagues are waiting for you to join our international team. We are working in a modern office, almost in the city center of Tampere. Working with us is uncomplicated, there’s a good team spirit, low-hierarchy and nonexistent bureaucracy. Our way of working is flexible too, many of our team work remotely from home with visits to our office from time to time when needed. This role is equally challenging, and as such we offer a very good compensation. We would hope that you are able to start as soon as possible but we are of course ready to be flexible also",30d+,False,,51 to 200,Company - Public,,,,,0.89,,4.2,3.7,3.9,4.1,4.2,"['""Good salary and exciting projects"" (in 4 reviews)', '""Good atmosphere"" (in 2 reviews)', '""Talented people, versatile environment, growth opportunity"" (in 1 reviews)']","['""Sometimes colleagues could be a little more senior in their competences."" (in 3 reviews)', '""No good benefits, lunch benefits are a joke"" (in 1 reviews)']",,
ABB,4.0,Helsinki,After Sales Engineer,"After Sales Engineer
Take your next career step at ABB with a global team that is energizing the transformation of society and industry to achieve a more productive, sustainable future. At ABB, we have the clear goal of driving diversity and inclusion across all dimensions: gender, LGBTQ+, abilities, ethnicity and generations. Together, we are embarking on a journey where each and every one of us, individually and collectively, welcomes and celebrates individual differences.

We are looking for an After Sales Engineer at ABB Oy, Marine and Ports division in Vuosaari, Helsinki. You will be working in the Service, Spare Parts department, which supplies spare part-related services to marine customers. In this position, you will have overall responsibility for selling spare parts for ships’ new build projects to designated customers. The inquiries’ scope varies between single spare parts to complete spare part sets. Benefits we offer at the moment include e.g. an annual performance bonus, a flexible working model, subsidized lunch, development & training, employee share ownership program, benefits for families with children, sports, massage and cultural benefits and many hobby clubs.",30d+,False,,10000+,Company - Public,Manufacturing,1883,Electronics Manufacturing,$10+ billion,0.82,0.89,3.7,3.6,4.0,3.5,3.8,"['""processes are well defined and work life balance good"" (in 619 reviews)', '""Good Salary and project exposure"" (in 821 reviews)', '""Good benefit and remuneration package"" (in 347 reviews)', '""Good management and get to work remotely"" (in 406 reviews)', '""Good culture and athmosphere in general"" (in 604 reviews)']","['""No work life balance and no decent hike"" (in 619 reviews)', '""Low salaries and less organized and no defined responsibilities"" (in 821 reviews)', '""No benefits...compare to other MNCs..in respect to increments..."" (in 347 reviews)', '""poor management and review system"" (in 406 reviews)', '""Bad culture and i didn\'t like the food"" (in 604 reviews)']",3.7,"['Health Insurance (87 comments)\n""Lack of coverage for common transgender care compared to other large companies.""', 'Vacation & Paid Time Off (71 comments)\n""Unlimited time off. Good if you have a good manager and you stay on top of claiming it.""', '401K Plan (46 comments)\n""3% plus 75% match up to 6% employee contribution.""']"
Anderson RH,,Kouvola,Metallurgist / Mineral Processing Sales Engineer - Mining flotation plants H/F Finlande,"Minimum 3 years of experience in mineral processing, specifically in Mining flotation plants.
Must speak Finnish and English fluently
Bachelor's degree in Metallurgical, Mining or Chemical Engineering
Hands-on lab skills to conduct metallurgical lab testing are essential.
We are looking for
A Metallurgist / Mineral Processing Engineer to take a lead as a Technical Sales Representative in the realization of the Mineral Processing (Mining flotation plants), and the business growth objective for the Western Europe region.
We count on you to",30d+,True,,,Company - Public,,,,,,,,,,,,,,,
Canonical - Jobs,3.1,Helsinki,Senior Software Engineer - Digital Workplace,"The role
Our Workplace Engineering team are a highly performant group which specialises in web architecture and analytics specialists. Building new tools, dashboards and analytics that empower colleagues, managers and executives to make better decisions and deliver better work.
About Canonical
Canonical is a pioneer in the digital workplace, established in 2004 with a global, remote-first policy that has delivered world-class open source and sets the pace in cloud, developer and IoT technology.
We are dedicated to continually improving to keep Canonical the best at remote work. It's part of our enjoyment of our mission - both to deliver the world's best free software, and to push the boundaries of 21st-century work and collaboration.",30d+,False,,501 to 1000,Company - Private,Information Technology,2004,Computer Hardware Development,$25 to $100 million,0.55,0.53,3.3,3.4,3.1,2.7,3.5,"['""Remote work Open source work Great people"" (in 48 reviews)', '""Good management"" (in 33 reviews)', '""A good salary is not a substitute for a miserable life."" (in 27 reviews)', '""Work from home, in your timezone, no extra hours (unless very rare situations)"" (in 20 reviews)']","['""men surrounding CEO and CTO"" (in 41 reviews)', '""having to learn about everything means very few people are truly specialized at what they do"" (in 48 reviews)', '""Management is not consistent, path to promotion is foggy"" (in 33 reviews)', '""If you do get hired, base salary is average at best, and extended benefits such as matching 401(k) are nonexistent."" (in 27 reviews)']",3.3,"['Work From Home (10 comments)\n""Fully remote working environment for most employees""', 'Health Insurance (8 comments)\n""No cost as individual employee""', 'Vacation & Paid Time Off (5 comments)\n""Must use personal days for end of year break""']"
Smartly.io Job Board,4.3,Helsinki,Senior Software Engineer (Feed Management),"We are looking for an experienced backend focused engineer to join team Aqueduct, a team building our feed management solution for large-scale cross-platform social advertising. We are looking for a seasoned professional to enable the long-term growth and product success for the team.
For our customers, providing e.g. product, hotel or flight data as feeds can unlock the potential of creative automation with image templates as well as many other nifty features of Smartly.io app. As we are supporting more and more social channels we want to develop our robust feed management platform to serve them all from a one-stop shop. For this, we are looking for a person familiar with solving complex technical problems, who can also seize learning opportunities and share them with the team.
Aqueduct has a backend written in Ruby on Rails. As the team will be starting new projects with some frontend work, you will have the chance to also learn and work with modern frontend technologies like and .",30d+,True,,501 to 1000,Company - Private,Information Technology,2013,Enterprise Software & Network Solutions,$100 to $500 million,0.89,0.82,4.1,4.1,4.5,3.8,4.5,"['""Good culture"" (in 52 reviews)', '""The people here are really a great bunch of people who are driven but willing to share to help you grow"" (in 40 reviews)', '""Some great benefits"" (in 12 reviews)', '""Engaged leadership open to feedback."" (in 18 reviews)', '""Good work/life balance (Especially for tech industry)"" (in 10 reviews)']","['""MT is working hard to keep the culture but this will be a challenge to tackle."" (in 52 reviews)', '""Not so many benefits for Latam"" (in 12 reviews)', '""Very poor leadership"" (in 18 reviews)', '""work life balance is hard sometimes"" (in 10 reviews)']",4.6,
Canonical - Jobs,3.1,Helsinki,Senior DevOps Engineer,"Help us shape the future of open source IT, devops, and IS, from bare metal to containers. Our goal is to revolutionise open source application and infrastructure operations.
We are on a mission to reshape the world of software operations, using Python for next-generation infrastructure-as-code and blazing a trail to model-driven operations. We want to enable companies to run very efficient bare metal operations for high performance computing, private cloud, data lakes and analytics. To achieve this we need to invent some new technology, and we need to build some new products. In support of that goal we hire software engineers who are passionate about quality, reliability and devops, to join our regional devops teams.
This team is part of our fully managed infrastructure operations organisation. We run many private clouds and Kubernetes clusters for customers around the world, which enables us to improve our infra-as-code products based on our own real experience, mirroring that of our users and customers. We work in Python, creating open source operations capabilities that simplify these operations for anybody, worldwide, who is building on Ubuntu.",30d+,False,,501 to 1000,Company - Private,Information Technology,2004,Computer Hardware Development,$25 to $100 million,0.55,0.53,3.3,3.4,3.1,2.7,3.5,"['""Remote work Open source work Great people"" (in 48 reviews)', '""Good management"" (in 33 reviews)', '""A good salary is not a substitute for a miserable life."" (in 27 reviews)', '""Work from home, in your timezone, no extra hours (unless very rare situations)"" (in 20 reviews)']","['""men surrounding CEO and CTO"" (in 41 reviews)', '""having to learn about everything means very few people are truly specialized at what they do"" (in 48 reviews)', '""Management is not consistent, path to promotion is foggy"" (in 33 reviews)', '""If you do get hired, base salary is average at best, and extended benefits such as matching 401(k) are nonexistent."" (in 27 reviews)']",3.3,"['Work From Home (10 comments)\n""Fully remote working environment for most employees""', 'Health Insurance (8 comments)\n""No cost as individual employee""', 'Vacation & Paid Time Off (5 comments)\n""Must use personal days for end of year break""']"
Nipromec Oy Ltd,5.0,Tampere,Lead Piping Engineer,"Nipromec Oy Ltd is an international consulting and engineering company founded in 2003. We offer design and consulting services for multiple industries with emphasis on energy and construction. Nipromec offices in Finland are located in Rauma, Turku, Tampere and Helsinki. Group has offices also in Erlangen, Germany, Bristol and London in United Kingdom.
We are now looking for a LEAD PIPING ENGINEER to work for customer projects in Tampere region for permanent employment.
You will work as a main designer in versatile Finnish and international industry projects and you will be in charge of a designing group.
As Lead Piping Engineer, you are responsible for coordinating the projects piping engineering discipline, leading core & subcontracted engineering, and working closely with the procurement and other various project functions. Your typical day includes follow-up with team members and progress reporting. You will be a key participant in customer meetings and driving best-in-class customer solutions from the sales phase, continuing through start-up & as built documentation.",30d+,False,,51 to 200,Company - Public,,2003,,$5 to $25 million,1.0,,5.0,3.0,4.0,5.0,5.0,,,,
ICEYE,3.9,Finland,Staff Geospatial Software Engineer,"Position: Staff Geospatial Software Engineer
Location: Espoo, Finland, remote
Hiring Model: Hybrid
Who are we?
We are a Finnish-based international New Space company with employees from more than 57 nationalities. Our team is a tight-knit group of experts from areas including engineering, software development, and radar technology. We’re innovative, driven people who strive for excellence in everything we do. Being advocates of our corporate culture, we value teamwork and curiosity, and we know how to have fun!
What do we do?
ICEYE is building and operating its commercial constellation of small Synthetic Aperture Radar (SAR) satellites with SAR data available to customers. Our satellites acquire images of Earth at any time – even when it’s cloudy or dark – providing commercial and government partners with unmatched persistent monitoring capabilities. Information derived from our SAR images helps customers make data-driven decisions to address time-critical challenges in various sectors, such as maritime, disaster management, insurance, and finance.
What are we looking for?
To support the growth of the company, we are looking for a Staff Geospatial Software Engineer to support our ICEYE Analytics in the Helsinki area, Finland. ICEYE Analytics is responsible for building solutions that enable near-real-time assessment of the impact of global natural catastrophes and geophysical change using remote sensing technology. These solutions empower end users to quantitatively make timely actions for event characterization, assessment, and response during stressful and uncertain times.
About the role?
As a Staff Geospatial Software Engineer, you will take a technical leadership of services providing external geospatial data used in ICEYE Solutions Products. You will help to architect and deploy fast, efficient, and scalable geospatial data services and pipelines. You will report to the Director of the Applications Engine in the Analytics team.
Responsibilities


Diversity& inclusion are core values at ICEYE. We are passionate about building and sustaining inclusive and equitable working and learning environments for all staff. We believe every member on our team enriches our diversity by exposing us to a broad range of ways to understand and engage with the world, identify challenges, and discover, design, and deliver solutions.
Could this be the role for you? Apply now to start your journey with ICEYE.
We are making the impossible possible together.
Contact
Paul du Plessis
recruiting@iceye.fi",20d,True,,201 to 500,Company - Public,Aerospace & Defense,2015,Aerospace & Defense,,0.79,0.86,3.7,3.6,3.9,3.3,3.3,"['""Good benefits overall"" (in 7 reviews)', '""Salary is competitive and includes a variety of great employee benefits."" (in 10 reviews)', '""great friendly culture"" (in 18 reviews)', '""Exciting company to work for Doing some amazing things with New Space technology Amazing group of staff"" (in 14 reviews)', '""Very diverse, awesome team, love the office spaces and the company culture"" (in 12 reviews)']","['""Pay and benefits are average for the industry."" (in 7 reviews)', '""Salary is not the best, the company manufactures satellites, which isn\'t a cheap thing to do, there are fees for ground stations, for the company which is sending the satellite out to space, etc, which are all reasons for why the company isn\'t swimming in cash."" (in 10 reviews)', '""Culture, no visibility in company’s long term goals"" (in 18 reviews)']",,
