Company_name,Rating,Location,Job_title,Description,Salary,Job_age,Easy_apply,Employees,Type_of_ownership,Sector,Founded,Industry,Revenue_USD,Friend_recommend,CEO_approval,Career_opportunities,Comp_&_benefits,Culture_&_values,Senior_management,Work/Life_balance,Pros,Cons,Benefits_rating,Benefits_reviews
Hewlett Packard Enterprise,4.2,Galway,Software Engineer in Test SDET,"Software Engineer in Test SDET

This role has been designated as ‘Edge’, which means you will primarily work outside of an HPE office.
Job Description:

Advance the way you live and work at HPE.
Who We Are:
A career in the HPE GreenLake Platform Cloud (GLCP) team allows you the opportunity to create history and push the industry forward, redefining the state of the art in what cloud computing means. Come and help us build a large scale, enterprise ready platform, powering a hybrid edge-to-cloud world. Our platform allows some of the largest most diverse enterprises in the world to deliver with speed, agility, and scale – while keeping their data where it needs to be and ensuring their sustainability and green goals are met and exceeded.
Engineering
Specialist",,30d+,False,10000+,Company - Public,Information Technology,2015,Information Technology Support Services,,0.87,0.94,3.8,3.7,4.3,3.8,4.3,"['""Good work life balance and learn"" (in 311 reviews)', '""Nice helping environment and good salary"" (in 287 reviews)', '""Good and challenging work with good culture"" (in 239 reviews)', '""Great people and fun work"" (in 197 reviews)', '""Good benefits Opportunity to grow"" (in 110 reviews)']","['""no work life balance for beginners and freshers"" (in 311 reviews)', '""not a stable company and less salary"" (in 287 reviews)', '""Culture was badly impacted by the several acquisitions and spin off."" (in 239 reviews)', '""Always laying off people."" (in 197 reviews)', '""Bad in hikes and benefits"" (in 110 reviews)']",3.6,"['Health Insurance (347 comments)\n""Good health benefit for family""', 'Vacation & Paid Time Off (169 comments)\n""No paid off time at all""', '401K Plan (160 comments)\n""Their 401 and they did matching""']"
Tata Consultancy Services,3.9,Letterkenny,IT Support Engineer - Italian Speaking,"Job Type
Permanent
Category
Technical Support
Location
Letterkenny, County Donegal, Ireland
Office Location
Job Details",,30d+,False,10000+,Company - Public,Information Technology,1968,Software Development,$10+ billion,0.74,0.85,3.7,3.1,4.0,3.3,3.9,"['""Good work life balance and also many thing to grow as a employee and a person"" (in 5831 reviews)', '""Salary is good and benifts also"" (in 8287 reviews)', '""Good job security and policies"" (in 7128 reviews)', '""good in work culture good in work culture good in work culture good in work culture good in work culture"" (in 2951 reviews)', '""Management is good and helpful is everyway possible"" (in 2113 reviews)']","['""No work life balance for some people and some people doesn\'t have work to do."" (in 5831 reviews)', '""Salary will be less for bps process hikes and promotion are way ahead thats all nothing to add"" (in 8287 reviews)', '""Less job security"" (in 7128 reviews)', '""Bad work culture and work type"" (in 2951 reviews)', '""Poor management and they put a person to any project without knowing their skills and interests."" (in 2113 reviews)']",3.3,"['Health Insurance (353 comments)\n""Good Insurance coverage, but does not cover 65+ parents. You need to pay more to cover them.""', 'Vacation & Paid Time Off (175 comments)\n""Provide timely approvals and paid leave can be carry forward""', '401K Plan (99 comments)\n""50% match for first 5%.""']"
Hero Recruitment,4.8,Galway,Senior Continuous Improvement Engineer,"Senior Continuous Improvement Engineer
Location: Galway
Our client who is a leading medical device company based in Galway is looking for a Senior Continuous Improvement Engineer to join their team.
Responsibilities
Leading continuous improvement (CI) projects and actively support developing a Lean culture through example and practice.
Leading GROWTTH® events, (TQM, Kaizens, VSM, A3, 5S, 3P etc) and systemising the output.",,21d,True,1 to 50,Company - Public,Human Resources & Staffing,1996,HR Consulting,,0.95,,4.5,4.4,4.8,4.8,4.8,"['""Great culture!"" (in 4 reviews)', '""Great people, great leaders, superb work life balance, remote working and 4 day week"" (in 4 reviews)', '""Great work life balance!"" (in 2 reviews)', '""Plenty of room for career progression."" (in 2 reviews)', '""Great working environment."" (in 1 reviews)']",['No Cons have been reported by the Glassdoor community.'],,
Dillon Engineering Services,5.0,Limerick,BIM Designers - Multiple Opportunities,"Dillon Engineering Services has partnered with multiple Mechanical & Electrical Contractors, Engineering Consultancies, and Main Contractors throughout Ireland who are looking to hire several BIM Engineers/Detailers/Designers/Coordinators.
Due to a large pipeline of work over the coming months and years these companies are now looking to hire BIM professionals with either an Electrical or Mechanical background.
Keys Details:
Office Locations - Dublin, Kildare, Kilkenny, Waterford, Limerick, and Mayo.
Software's Used - Revit, Plant 3D, BIM 360, Navisworks, AutoCAD
Hybrid/WFH work model available for the right candidate.",,7d,True,1 to 50,Company - Private,Human Resources & Staffing,2019,HR Consulting,$1 to $5 million,1.0,1.0,5.0,5.0,5.0,5.0,5.0,"['""Friendly and efficient service"" (in 1 reviews)', '""Excellent communication"" (in 1 reviews)']",['No Cons have been reported by the Glassdoor community.'],,
Hero Recruitment,4.8,Galway,Electrical Design Engineer,"We are looking to speak with experienced Electrical Design Engineers about this great new job opportunity in Galway with one of our leading clients. This company stands out for their culture, exceptional career development pathways and unrivalled rewards and recognition packages.
This exciting new job opportunity in Electrical Design Engineering is located in Galway, which was voted ""Europe's most Friendliest City 2020""!
Apply to us to find out more about this great job opportunity in Electrical Design Engineering in Galway and we can talk through if it's the right job for you.

Job Purpose",,24d,True,1 to 50,Company - Public,Human Resources & Staffing,1996,HR Consulting,,0.95,,4.5,4.4,4.8,4.8,4.8,"['""Great culture!"" (in 4 reviews)', '""Great people, great leaders, superb work life balance, remote working and 4 day week"" (in 4 reviews)', '""Great work life balance!"" (in 2 reviews)', '""Plenty of room for career progression."" (in 2 reviews)', '""Great working environment."" (in 1 reviews)']",['No Cons have been reported by the Glassdoor community.'],,
Jaguar Land Rover,3.8,Shannon,Engineering Manager,"Job Description


REQ ID: 105041
JOB TITLE: Engineering Manager
SALARY: Competitive
LOCATION: Shannon, Ireland

Dreaming for tomorrow is about more than ideas and ambitions. We're already building the next generation of vehicles, using repurposed and brand-new technology and techniques. We're doing more than dream, we're creating the future of mobility and automotive for years to come.



This is an excellent opportunity for an enthusiastic and experienced Engineering Manager with a background in leadership and mentorship, who has a passion for employee development and stake holder satisfaction.

The main purpose of this role is to support the design and development of disruptive and innovative technologies. The team are the centre of gravity for testing excellence in JLR and this steam specifically develop bleeding edge solutions that have a direct impact on our vehicle range.

This platform is used in all facets of engineers, some of note are autonomous vehicles and advanced control systems, electric powertrains, to class-leading infotainment, cloud-connected features, and integration of consumer electronic technologies, not to mention the opportunity to drive & test advanced prototype vehicles.


































Internally: working within Product Engineering across multiple workgroups and cross-functional teams.

Cloud and Embedded Software Teams

Software Validation Team(s)

Product Owner(s)

Scrum Master(s)

Agile Coach(es)

: working with Academia and external partners to ensure our engineers are being enabled to maximise success in their careers.



Bring all this to the home of premium innovation, and you'll find the opportunities to further your career with a world-class team, a discounted car purchase and lease scheme for you and your family, membership of a competitive pension plan and private medical cover. All this and more makes Jaguar Land Rover the perfect place to continue your journey.

Jaguar Land Rover is committed to equal opportunity for all.",,30d+,False,10000+,Company - Private,Manufacturing,2008,Consumer Product Manufacturing,,0.74,0.85,3.6,3.7,3.6,3.3,3.8,"['""team outings and good salary"" (in 131 reviews)', '""Good hours and work/life balance."" (in 83 reviews)', '""Good management and internal learning"" (in 105 reviews)', '""If you get along with the people on your team then it can be great fun."" (in 91 reviews)', '""They have a good culture."" (in 95 reviews)']","['""2. Average salary is low"" (in 131 reviews)', '""existent work life balance."" (in 83 reviews)', '""Poor Management and Value Uptake from Employees"" (in 105 reviews)', '""Uncertainty during the downturn resulted in many good people lost, and months of uncertainty."" (in 91 reviews)', '""driven culture but it\'s being addressed"" (in 95 reviews)']",3.7,"['Health Insurance (3 comments)\n""Company provides basic work insurance""', 'Vacation & Paid Time Off (3 comments)\n""Overtime is paid and above average number of holidays""', 'Employee Discount (3 comments)\n""Employee can get better deal in company car""']"
Joule Ltd,,Dublin,Production Engineer,"We are looking for a Production Engineer to join our team. The role will provide technical support for manufacturing operations at our Dublin site and for the introduction and successful start-up of new product lines and technologies. We are looking for a person with good technical knowledge, excellent problem solving skills and growth potential. This is a permanent full-time position, based at our new modern facility and reports to the Production Manager.
Company Overview
Joule is a multinational manufacturer and distributor of heating, ventilation, hot water and renewable energy solutions, operating in the Irish, UK and European markets. We have a number of manufacturing locations throughout Europe. In our state of the art facility in Dublin, we manufacture a wide range of products using innovative designs and utilizing the most up to date production methods",,30d+,True,,,,,,,,,,,,,,,,,
Amcor Flexibles Sligo,3.5,Sligo,QA Validation Engineer,"Job Purpose
Reporting to the Quality Manager, the QA Validation Engineer will be responsible for the validation/qualifying equipment, systems and processes in accordance with regulatory requirements and company manufacturing standards
Principal Accountabilities
·Generates, executes, reviews and approves master and completed qualification and validation protocols, summary reports and associated data for conformance to regulations, SOPs, specifications and other applicable acceptance criteria
Prepares equipment for qualifications studies and executes qualification and validation studies according to approved protocols and SOP.",,10d,True,10000+,Company - Public,Manufacturing,1860,Machinery Manufacturing,$5 to $10 billion,0.71,0.76,3.3,3.5,3.5,3.2,3.3,"['""There are nice people working there."" (in 8 reviews)', '""Benefits, Pay, Management is fair."" (in 7 reviews)', '""Good pay, decent benefits but the premiums have gone recently."" (in 5 reviews)', '""Not too overworked and 3rd shift employees are great people"" (in 9 reviews)']","['""management is horrible, they do not pay well"" (in 7 reviews)', '""competitive pay"" (in 5 reviews)', '""Office employees are superior and if you\'re an hourly employee, you mean nothing."" (in 9 reviews)', '""Middle and upper management see IT exclusively as a cost center."" (in 4 reviews)']",4.0,"['Health Insurance (26 comments)\n""Best thing is the insurance options worst is the cost""', 'Vacation & Paid Time Off (15 comments)\n""Very competitive Pto offered if you negotiate it""', '401K Plan (14 comments)\n""Very good match but 3 year vestment""']"
Hero Recruitment,4.8,Galway,R&D Engineer II,"R&D Engineer II Due to continued expansion of our operations, we are seeking applications from a suitably qualified and experienced R&D Engineer II (Permanent). Our Research and Development team has invented breakthroughs that have improved millions of lives worldwide. Creativity, curiosity and a deep caring for human life are fundamental to our culture. That passion for innovation shows-Forbes lists us as one of the 100 most innovative companies in the world. Join us, and you'll be part of our mission to push the boundaries of science, right from the start. With access to some of the most exciting global technologies, you'll find the work here challenging and rewarding. What's more, you'll be in an environment where your colleagues will truly listen to your big ideas and turn them into results. We are seeking a highly motivated R&D Engineer to join the Galway Structural Heart R&D team.
Be a part of one of the company's most exciting areas of growth. The successful candidate will join a dynamic team in developing products, materials, processes, tests or equipment for medical device products in the treatment of heart disease. This candidate will participate in an interdisciplinary team of engineers working on transcatheter heart valve devices from project concept, through product development and post commercialisation.",,24h,True,1 to 50,Company - Public,Human Resources & Staffing,1996,HR Consulting,,0.95,,4.5,4.4,4.8,4.8,4.8,"['""Great culture!"" (in 4 reviews)', '""Great people, great leaders, superb work life balance, remote working and 4 day week"" (in 4 reviews)', '""Great work life balance!"" (in 2 reviews)', '""Plenty of room for career progression."" (in 2 reviews)', '""Great working environment."" (in 1 reviews)']",['No Cons have been reported by the Glassdoor community.'],,
,,,,,,8d,False,,,,,,,,,,,,,,,,,
Curran BIM Management Ltd,,Wicklow,Piping Designer,"Curran BIM Management is looking to source a number of experienced Piping Designers for both internal projects and site based secondments with key clients in Dublin & Cork.
Our clients are leading design & engineering firms who are specialise in the life sciences, data centre & semi conductor sectors. Both long-term contracts and staff options on offer for designers of suited calibre.
Long-term work and hybrid working models available.
For further info, please contact Daniel (Design & Recruitment Manager) on 087-242 1331.
The Piping Designer will work on various projects as assigned by a Project Managers & Lead Designers. They will play a key role in the entire design process including but not limited to preliminary assessments, concept creation, design and problem resolution.",,28d,True,,,,,,,,,,,,,,,,,
Hewlett Packard Enterprise,4.2,Galway,Senior Quality Assurance Engineer,"Senior Quality Assurance Engineer

This role has been designated as ‘Edge’, which means you will primarily work outside of an HPE office.
Job Description:

Hewlett Packard Enterprise is the global edge-to-cloud company advancing the way people live and work. We help companies connect, protect, analyze, and act on their data and applications wherever they live, from edge to cloud, so they can turn insights into outcomes at the speed required to thrive in today’s complex world. Our culture thrives on finding new and better ways to accelerate what’s next. We know diverse backgrounds are valued and succeed here. We have the flexibility to manage our work and personal needs. We make bold moves, together, and are a force for good. If you are looking to stretch and grow your career our culture will embrace you. Open up opportunities with HPE.
Engineering
Specialist",,30d+,False,10000+,Company - Public,Information Technology,2015,Information Technology Support Services,,0.87,0.94,3.8,3.7,4.3,3.8,4.3,"['""Good work life balance and learn"" (in 311 reviews)', '""Nice helping environment and good salary"" (in 287 reviews)', '""Good and challenging work with good culture"" (in 239 reviews)', '""Great people and fun work"" (in 197 reviews)', '""Good benefits Opportunity to grow"" (in 110 reviews)']","['""no work life balance for beginners and freshers"" (in 311 reviews)', '""not a stable company and less salary"" (in 287 reviews)', '""Culture was badly impacted by the several acquisitions and spin off."" (in 239 reviews)', '""Always laying off people."" (in 197 reviews)', '""Bad in hikes and benefits"" (in 110 reviews)']",3.6,"['Health Insurance (347 comments)\n""Good health benefit for family""', 'Vacation & Paid Time Off (169 comments)\n""No paid off time at all""', '401K Plan (160 comments)\n""Their 401 and they did matching""']"
KCMG Engineering,,Dublin,Mechanical Engineer,"Overview:
Due to continued growth, we are looking to hire a Mechanical/Building Service Engineer in a permanent role, working from our Dublin office. You will get the opportunity to work on a range of Data Centre and Commercial Projects, from the early construction stage through to construction, commissioning, and handover.
Responsibilities:
Review and coordination of Mechanical Design drawings & specifications.
Preparation of Project-Specific Technical Submittals.
Generation of Data Sheets, Material Requisitions & Enquiry Packages for procurement of equipment",,29d,True,,,,,,,,,,,,,,,,,
BSS Building Staff Solutions,3.8,Clare,Senior Civil Engineer,"Job Title - Senior Civil Engineer - Clare & Midwest
Location: Mid West
Salary: €60K - €70K DOE
Hours: Full time 5 days
An opportunity has now arisen for a Senior Civil Engineer to work with an established Main Contractor on a range of residential and commercial projects in Clare & the Midwest.
This is a permanent role.
Experience required in the following:",,3d,True,51 to 200,Company - Private,,,,,0.41,,3.1,3.2,2.7,3.0,2.8,"['""Excellent good nice very nice"" (in 1 reviews)']",['No Cons have been reported by the Glassdoor community.'],3.0,
Evolved Energy Solutions Ltd,,Kildare,BER Assessor / Energy Consultant,"The candidate will be expected to travel to various client sites in the greater Leinster area, gather and collect on site technical data and generate BER and Energy Improvement reports based on their findings. The role will require the candidate to provide individual customers with bespoke reports and advice on the best energy upgrades applicable to them.
While the list of skills and competencies given below are an advantage they are not all essential as training can and will be provided. Evolved Energy Solutions will provide the candidate with on the job training in any areas they feel it is required. We are looking for a BER experienced or similar operative for this role.
Have completed and successfully passed the BER assessor training course
Have a construction based Level 7 Qualification",,1 day ago,True,,,,,,,,,,,,,,,,,
Jaguar Land Rover,3.8,Shannon,Software Developer,"Job Description


JOB TITLE: Software Developer - Hybrid Working
SALARY: Competitive
LOCATION: Shannon, Ireland

Dreaming for tomorrow is about more than ideas and ambitions. We're already building the next generation of vehicles, using repurposed and brand-new technology and techniques. We're doing more than dream, we're creating the future of mobility and automotive for years to come.



The main purpose of this role is to support the complete life cycle of new/modified software product, from research and design to implementation, training and support in the cloud.

The individual will work with lead engineers to write and modify programmes; testing code; diagnosing faults in software; and designing programmes to solve those faults. All these tasks typically involve a detailed and meticulous problem-solving process. To work within an Agile and Scrum manner to focus on incremental delivery of platform components and capabilities, with early feedback input required from both colleagues and stakeholders.







Essential:



For more information about Jaguar Land Rover take a look at www.jaguarlandrover.com/www.jaguarlandrovercareers.com and connect with us on LinkedIn



Bring all this to the home of premium innovation, and you'll find the opportunities to further your career with a world-class team, a discounted car purchase and lease scheme for you and your family, membership of a competitive pension plan and private medical cover. All this and more makes Jaguar Land Rover the perfect place to continue your journey.

Jaguar Land Rover is committed to equal opportunity for all.",,30d+,False,10000+,Company - Private,Manufacturing,2008,Consumer Product Manufacturing,,0.74,0.85,3.6,3.7,3.6,3.3,3.8,"['""team outings and good salary"" (in 131 reviews)', '""Good hours and work/life balance."" (in 83 reviews)', '""Good management and internal learning"" (in 105 reviews)', '""If you get along with the people on your team then it can be great fun."" (in 91 reviews)', '""They have a good culture."" (in 95 reviews)']","['""2. Average salary is low"" (in 131 reviews)', '""existent work life balance."" (in 83 reviews)', '""Poor Management and Value Uptake from Employees"" (in 105 reviews)', '""Uncertainty during the downturn resulted in many good people lost, and months of uncertainty."" (in 91 reviews)', '""driven culture but it\'s being addressed"" (in 95 reviews)']",3.7,"['Health Insurance (3 comments)\n""Company provides basic work insurance""', 'Vacation & Paid Time Off (3 comments)\n""Overtime is paid and above average number of holidays""', 'Employee Discount (3 comments)\n""Employee can get better deal in company car""']"
Curran BIM Management Ltd,,Kildare,BIM Technician,"Our client is a global Engineering / Design (EPCMV) consultancy who specialise in the life sciences space.
Due to a number of major pharmaceutical projects in the pipeline they are seeking to expand both their Dublin & Cork BIM Design teams.
The successful BIM Technicians can avail of either staff or contract options and work from either their Cork or Dublin offices, in a hybrid capacity (2 days in the office, 3 days remote).
Strong staff packages and contractor options on offer for BIM professionals of suited calibre and long-term work is guaranteed.
General Role Overview:",,23d,True,,,,,,,,,,,,,,,,,
Hero Recruitment,4.8,Galway,Mechanical Design Engineer II,"Title: Mechanical Design Engineer
Department: R&D
Type: 12 month contract (to be expended doe).
Location: Galway

The client is the world's leading provider of driving assistance systems to automotive manufacturers.
The client, located near Galway, Ireland is the client's worldwide vision and automated
parking research and industrial center.

From being first to market in Europe with rear camera and surround view systems to producing
next-generation vision systems and autonomous driving products, VVS has long been at the cutting
edge of development in automotive vision applications.

Design Engineer position is based within the R&D department and will form an integral part of
a cross-functional team developing next generation vision systems for the automotive market. This is
a diverse position where the successful applicant is accountable and drives all the mechanical
aspects of their project(s), to deliver robust designs on time and within budget",,15d,True,1 to 50,Company - Public,Human Resources & Staffing,1996,HR Consulting,,0.95,,4.5,4.4,4.8,4.8,4.8,"['""Great culture!"" (in 4 reviews)', '""Great people, great leaders, superb work life balance, remote working and 4 day week"" (in 4 reviews)', '""Great work life balance!"" (in 2 reviews)', '""Plenty of room for career progression."" (in 2 reviews)', '""Great working environment."" (in 1 reviews)']",['No Cons have been reported by the Glassdoor community.'],,
